{
    "activityType": {
        "login": {
            "filters": {
                "authenticator": {
                    "attributeName": "Connection Type",
                    "values": {
                        "apple": "Apple",
                        "backupCodes": "Backup Code",
                        "basic": "Username & Password",
                        "emailOtp": "Email OTP",
                        "facebook": "Facebook",
                        "fido2": "FIDO2",
                        "github": "GitHub",
                        "google": "Google",
                        "hypr": "HYPR",
                        "identifierFirst": "Identifier First",
                        "iproov": "IPROOV",
                        "magicLink": "Magic Link",
                        "oidc": "OIDC IdP",
                        "organizationLogin": "Organization Login",
                        "saml": "SAML IdP",
                        "smsOtp": "SMS OTP",
                        "totp": "TOTP"
                    }
                },
                "identityProvider": "Connection ID",
                "serviceProvider": "Application",
                "userStore": "User Store"
            }
        },
        "m2m": {
            "filters": {
                "clientId": "Client ID",
                "tenantDomain": "Organization",
                "tenantDomainPlaceholder": "Search organization"
            }
        },
        "registration": {
            "filters": {
                "onboardingMethod": {
                    "attributeName": "Onboarding Method",
                    "values": {
                        "adminInitiated": "By administrator",
                        "selfSignUp": "Self-registration",
                        "userInvited": "Email invitation"
                    }
                }
            }
        }
    },
    "advancedFilter": {
        "filterAttribute": "Filter attribute",
        "filterCondition": "Filter condition",
        "filterValue": "Filter value"
    },
    "commonFilters": {
        "userId": "User ID"
    },
    "compareToLastPeriodMessage": "Compare to last period",
    "description": "Understand user behavior better with usage statistics.",
    "durationMessage": "Showing results from <1>{{ startTimestamp }}</1> to <1>{{ endTimestamp }}</1>",
    "durationOption": "Last {{ duration }} days",
    "graphs": {
        "activeUsers": {
            "title": "Active Users",
            "titleHint": "Number of unique users that signed in to your organization within the selected period"
        },
        "failedLogins": {
            "title": "Failed Logins"
        },
        "m2mAuthentications": {
            "title": "M2M Authentications",
            "titleHint": "Number of M2M token requests made to your organization within the selected period"
        },
        "signups": {
            "title": "User Signups",
            "titleHint": "Total user signups occurred within the selected period"
        },
        "successLogins": {
            "title": "Total Logins",
            "titleHint": "Number of successful logins to your organization within the selected period"
        }
    },
    "lastFetchedMessage": {
        "label": "Last fetched at {{ time }}",
        "tooltipText": "Insights for the latest activity will take few minutes to be reflected in the graphs"
    },
    "notifications": {
        "fetchInsights": {
            "genericError": {
                "description": "An error occurred while fetching insights for the selected duration.",
                "message": "Something went wrong"
            }
        }
    },
    "pageTitle": "Insights",
    "title": "Insights"
}
